{"$id":"https://awesome-self-skills.local/schemas/v5-permission-derivation-registry.schema.json","$schema":"https://json-schema.org/draft/2020-12/schema","additionalProperties":false,"properties":{"registry_digest":{"const":"sha256:d40cc1c21eb0ef362a73cc80523b3fec957c8c74db10026f8eafa41aeb394911"},"registry_format_version":{"const":1},"rules":{"items":false,"maxItems":1,"minItems":1,"prefixItems":[{"additionalProperties":false,"properties":{"allowed_actions":{"items":false,"maxItems":5,"minItems":5,"prefixItems":[{"const":"discover"},{"const":"enter"},{"const":"view"},{"const":"query"},{"const":"mutate"}],"type":"array"},"ambiguous_coordinate_result":{"const":"requirements_gap"},"emitted_cell_rule":{"const":"one_cell_per_signaled_dimension"},"optional_signaled_dimensions":{"items":false,"maxItems":2,"minItems":2,"prefixItems":[{"const":"denial_behavior"},{"const":"data_scope"}],"type":"array"},"required_coordinate_cardinality":{"additionalProperties":false,"properties":{"action":{"const":1},"context":{"const":1},"resource":{"const":1},"role":{"const":1}},"required":["role","resource","action","context"],"type":"object"},"required_dimension":{"const":"decision"},"rule_id":{"const":"permission.atomic-candidate-to-cells.v1"}},"required":["rule_id","required_coordinate_cardinality","required_dimension","optional_signaled_dimensions","allowed_actions","ambiguous_coordinate_result","emitted_cell_rule"],"type":"object"}],"type":"array"},"schema_version":{"const":"5.0.0"}},"required":["schema_version","registry_format_version","rules","registry_digest"],"type":"object"}
