{"registry_digest":"sha256:d40cc1c21eb0ef362a73cc80523b3fec957c8c74db10026f8eafa41aeb394911","registry_format_version":1,"rules":[{"allowed_actions":["discover","enter","view","query","mutate"],"ambiguous_coordinate_result":"requirements_gap","emitted_cell_rule":"one_cell_per_signaled_dimension","optional_signaled_dimensions":["denial_behavior","data_scope"],"required_coordinate_cardinality":{"action":1,"context":1,"resource":1,"role":1},"required_dimension":"decision","rule_id":"permission.atomic-candidate-to-cells.v1"}],"schema_version":"5.0.0"}
